file	tstamp	developer	version	lines_add	lines_del	description
/cvsroot/zile/zile/src/funcs.c	2001-01-19 23:02:17.0	ssigala	1.1	0	0	branches:  1.1.1;Initial revision
/cvsroot/zile/zile/src/funcs.c	2001-01-19 23:08:08.0	ssigala	1.1.1.2	9	97	import of version 1.3.
/cvsroot/zile/zile/src/funcs.c	2001-01-19 23:02:17.0	ssigala	1.1.1.1	0	0	import of version 1.4.
/cvsroot/zile/zile/src/funcs.c	2005-02-27 19:45:04.0	rrt	1.52.2.5	5	5	Fix whitespace.
/cvsroot/zile/zile/src/funcs.c	2005-01-18 01:33:04.0	rrt	1.52.2.4	3	9	Adapted code from nano 1.2.4 to fix suspend/resume when Zile is usede.g. under pine or mutt.
/cvsroot/zile/zile/src/funcs.c	2005-01-17 19:02:16.0	rrt	1.52.2.3	5	9	Fix auto-fill-mode so it applies to all new buffers, not just thefirst.
/cvsroot/zile/zile/src/funcs.c	2005-01-13 00:22:46.0	rrt	1.52.2.2	3	3	Fix a couple of bugs in transient_mark_mode.
/cvsroot/zile/zile/src/funcs.c	2005-01-12 14:01:45.0	rrt	1.52.2.1	8	1	In suspend_zile, handle the terminal better before and aftersuspension (fix also made to CVS head).
/cvsroot/zile/zile/src/Attic/getopt.c	2005-01-17 23:43:24.0	rrt	1.2	0	0	Use getopt_long_only instead of getopt_long for better Emacscompatibility (i.e. long options can start with a single dash).Rejig the getopt code again (remove lots more non-ANSI stuff) and useAC_REPLACE_FUNCS to import getopt_long_only.c. Assume that if we havethis function then we have getopt.h.
/cvsroot/zile/zile/src/Attic/getopt.c	2005-01-17 02:08:30.0	rrt	1.1	0	0	Add GNU getopt for getopt_long where necessary.
/cvsroot/zile/zile/src/getopt.h	2005-01-17 23:43:24.0	rrt	1.2	1	34	Use getopt_long_only instead of getopt_long for better Emacscompatibility (i.e. long options can start with a single dash).Rejig the getopt code again (remove lots more non-ANSI stuff) and useAC_REPLACE_FUNCS to import getopt_long_only.c. Assume that if we havethis function then we have getopt.h.
/cvsroot/zile/zile/src/getopt.h	2005-01-17 02:08:30.0	rrt	1.1	0	0	Add GNU getopt for getopt_long where necessary.
/cvsroot/zile/zile/src/Attic/getopt1.c	2005-01-17 23:43:24.0	rrt	1.2	0	0	Use getopt_long_only instead of getopt_long for better Emacscompatibility (i.e. long options can start with a single dash).Rejig the getopt code again (remove lots more non-ANSI stuff) and useAC_REPLACE_FUNCS to import getopt_long_only.c. Assume that if we havethis function then we have getopt.h.
/cvsroot/zile/zile/src/Attic/getopt1.c	2005-01-17 02:08:30.0	rrt	1.1	0	0	Add GNU getopt for getopt_long where necessary.
/cvsroot/zile/zile/src/getopt_long_only.c	2005-01-27 02:33:17.0	rrt	1.4	3	3	For simplicity, change unsigned and unsigned long to size_t.
/cvsroot/zile/zile/src/getopt_long_only.c	2005-01-27 00:45:00.0	rrt	1.3	3	3	Fix -Wconversion warnings in term_redisplay.c, and fix other placesthat this affects.Change &quot;unsigned int&quot; to &quot;unsigned&quot;.
/cvsroot/zile/zile/src/getopt_long_only.c	2005-01-17 23:57:51.0	rrt	1.2	10	144	Cut some more code we don&apos;t need.
/cvsroot/zile/zile/src/getopt_long_only.c	2005-01-17 23:43:24.0	rrt	1.1	0	0	Use getopt_long_only instead of getopt_long for better Emacscompatibility (i.e. long options can start with a single dash).Rejig the getopt code again (remove lots more non-ANSI stuff) and useAC_REPLACE_FUNCS to import getopt_long_only.c. Assume that if we havethis function then we have getopt.h.
/cvsroot/zile/zile/src/glue.c	2005-02-05 02:49:14.0	rrt	1.29	23	2	Make interactive commands work in macro; fixes #1088414 (again...).Rename term_getkey --&gt; getkey, and add xgetkey, defined in terms ofit.Move macro handling code from term_xgetkey in term_termcap.c toxgetkey (which is in glue.c).Rename GETKEY_NONFILTERED to GETKEY_UNFILTERED.
/cvsroot/zile/zile/src/glue.c	2005-01-29 13:55:00.0	rrt	1.28	3	3	Fix signed vs unsigned comparison warnings.
/cvsroot/zile/zile/src/glue.c	2005-01-27 02:33:17.0	rrt	1.27	5	5	For simplicity, change unsigned and unsigned long to size_t.
/cvsroot/zile/zile/src/glue.c	2005-01-27 02:27:23.0	rrt	1.26	4	4	Fix -Wconversion warnings.Make astr_truncate take a pos rather than a size.Fix setting of fill-column.
/cvsroot/zile/zile/src/glue.c	2005-01-27 00:54:08.0	rrt	1.25	2	2	Fix -Wconversion warnings in glue.c.
/cvsroot/zile/zile/src/glue.c	2005-01-27 00:52:43.0	rrt	1.24	2	2	Fix -Wconversion warnings in undo.c.
/cvsroot/zile/zile/src/glue.c	2005-01-25 19:01:27.0	rrt	1.23	2	2	Fix key processing (#109179) by unbuffering stdin, and make the keybuffer a dynamic string rather than a fixed-size buffer.Rename term_unget to term_ungetkey for consistency.
/cvsroot/zile/zile/src/glue.c	2005-01-23 15:11:39.0	rrt	1.22	1	19	Remove ZTRACE and ztrace, which were not really used any more.Move prototypes for zmalloc &amp;c. to a new section in extern.h(zmalloc.c) from glue.c, where the functions used to live.
/cvsroot/zile/zile/src/glue.c	2005-01-16 14:07:44.0	rrt	1.21	3	6	Add a delay argument to waitkey, and have a default, WAITKEY_DEFAULT,current 2s.
/cvsroot/zile/zile/src/glue.c	2005-01-10 15:09:46.0	rrt	1.20	4	4	Use list API instead of -&gt;next and -&gt;prev. Sometimes the API calls areused as lvalues, which is evil, but it&apos;s better than it was.
/cvsroot/zile/zile/src/glue.c	2005-01-10 02:31:53.0	rrt	1.19	3	3	Use new Line struct, which is just a typedef for list_s.Rename the limitp member of Buffer to lines.
/cvsroot/zile/zile/src/glue.c	2005-01-10 00:56:04.0	rrt	1.18	138	138	Since I currently seem to be the only person contributing code toZile, it seems reasonable to have the code formatted as I like it.Hence, reformat to 2-space columns rather than 8-space. Ah...that&apos;sbetter!
/cvsroot/zile/zile/src/glue.c	2004-11-15 01:47:12.0	rrt	1.17	1	43	Move contents of lib/ into src/. This is slightly awkward at themoment, but means that x{malloc,realloc,strdup} can be replaced bycalls to z{malloc,realloc,dup}, and the machinery for building libzileis not needed (it was rather pointless, although it was used by mkdocand the test programs of the libraries, which now won&apos;t work and willhave to be resurrected).This makes the arrangement of the code a bit simpler.Also move the z* functions into zmalloc.c so they can easily be linkedinto mkdoc.c.
/cvsroot/zile/zile/src/glue.c	2004-11-15 00:57:54.0	rrt	1.16	4	13	Sort out waitkey:1. Get rid of waitkey_discard. User input should not be discarded.2. Don&apos;t bother waiting for half a second during universal argument   input. This is pointless finessing (although Emacs does do it).3. Standardise on a two second pause when wait is required, and remove   the argument from waitkey. Before most of the pauses were 2 secs,   some were 3 and 1 was 1, for no obvious reason.4. Remove the 20 second waitkey for the splash screen. Let the user   take as long as they want to read it.
/cvsroot/zile/zile/src/glue.c	2004-11-14 17:29:07.0	rrt	1.15	2	2	Rename term_unget_char to term_unget (it really does unget akeystroke, not a char).
/cvsroot/zile/zile/src/glue.c	2004-10-16 22:17:03.0	rrt	1.14	8	8	Change waitkey functions to work in deciseconds. For a UI, msecs isunnecessarily fine.
/cvsroot/zile/zile/src/glue.c	2004-10-06 18:32:19.0	rrt	1.13	7	9	Change Line structure so that the text member is an astr. This meansthat the malloc system is worked a bit harder, but that line pointersdon&apos;t need to be twiddled when the length of a line changes, and thatthe code is simplified (we make far more use of standard astrroutines).As well as general code simplification, this should make instantdisplay updating easier to program.These changes are potentially capable of introducing bugs, but initialtests with simple editing have run cleanly in valgrind.Other misc cleanup, and further experimentation in term_termcap.c(which is still far from finished).
/cvsroot/zile/zile/src/glue.c	2004-05-21 00:34:50.0	rrt	1.12	6	6	Get rid of the function pointers from the Terminal type; we have nodesire to make a binary of zile that can use more than one sort ofterminal. (This doesn&apos;t stop us choosing at compile-time, of course!)
/cvsroot/zile/zile/src/glue.c	2004-03-30 00:47:01.0	rrt	1.11	26	6	Rename some string functions to more ISO standard-like names, e.g.astr_assign* becomes astr_cpy* and astr_append* becomes astr_cat*.They are shorter too!Also add getln (safe gets, I should probably call it agets!) toglue.c, in preparation for the Lisp interpreter, which is takingshape in my working copy.
/cvsroot/zile/zile/src/glue.c	2004-03-10 00:10:45.0	rrt	1.10	7	6	Remove char buffers from funcs.c; change shorten_string to return anastr to help this.Tweak the spacing of the headers for list-buffers to make them line upwith the output.
/cvsroot/zile/zile/src/glue.c	2004-02-17 21:21:18.0	ssigala	1.9	20	24	* Changed BSD license to GNU GPL:        - Removed COPYRIGHT file        - Added standard COPYING file        - Changed all the copyright declarations in source files.* Removed old lib/err.[ch] unused Zile heritage.* sed s/sandro@sigala.it/zile-devel@lists.sourceforge.net/* configure now checks for both curses.h and ncurses.h, libcurses.a and  libncurses.a.  e.g. on my box (SuSE 8.2) ncurses is installed as  ncurses.h and libncurses.a, on another as curses.h and libncurses.a...* Cleaned up zile.h:          - Now anchors are identified as an opaque type:                 typedef unsigned char Anchor;          - Enumerated UNDO_* delta types;          - Enumerated BMODE_* buffer major modes;          - Removed MINIBUF_{SET,UNSET}_COLOR stuff.* ncurses_minibuf.c:  removed astrlen() function, obsoleted by colors remove.* some other clean up.
/cvsroot/zile/zile/src/glue.c	2004-02-16 02:04:39.0	dacap	1.8	7	5	Fixed `tabify_string&apos;.
/cvsroot/zile/zile/src/glue.c	2004-02-08 05:39:26.0	dacap	1.7	14	62	Rewritten point/marker API mainly.
/cvsroot/zile/zile/src/glue.c	2004-01-28 11:47:33.0	rrt	1.6	2	2	Whitespace correction.
/cvsroot/zile/zile/src/glue.c	2004-01-21 02:50:05.0	dacap	1.5	24	1	Added `goto_point&apos; routine from undo.c.
/cvsroot/zile/zile/src/glue.c	2003-10-25 01:32:08.0	ssigala	1.4	20	3	* minor fixes to expand_path().* fixed memory leak in usage of agetcwd().  Now agetcwd() also uses a  previously allocated astr to store the directory name (simplifies  the code).* fixed problem about relative directories, when zile is called  with filenames on the command line (e.g., `zile term_ncurses/*.c&apos;  now works correctly).* introduced astr_isempty(), astr_first_char(), astr_last_char() sugar  functions.  &quot;astr_last_char(as)&quot; is certainly better than the ugly  &quot;astr_cstr(as)[astr_size(as) - 1]&quot;.* introduced ZTRACE() function to make debugging easier.* renamed ANCHOR_SPECIAL to ANCHOR_HEREDOC because  cat &lt;&lt;EOF  bla  EOF  stuff is usually called here-document.* renamed `font-special&apos; variable to `font-here-document&apos;.* added `font-here-document&apos; to tbl_vars.h, zilerc.sample and Texinfo.* redisplay speedup: cache a few more variables:  status-line-color, display-time-format, displayable-characters.* startup speedup: do not cache the variables too ofter.* made make_heredoc_string more flexible.* fixed zlint.* documented `sh-mode&apos;, `kill-word&apos;, `backward-kill-word&apos; in Texinfo.* other fixes.
/cvsroot/zile/zile/src/glue.c	2003-05-07 00:28:42.0	rrt	1.3	2	2	Land the 1.7 sources. This is basically 1.7-a7 (unreleased except onSandro&apos;s home page) plus my and Nicolas Duboc&apos;s 1.6.2 fixes, plus somepatches to 1.7-a6 from David Capello.
/cvsroot/zile/zile/src/glue.c	2003-04-24 17:11:59.0	rrt	1.2	48	4	Committing 1.6.2 sources.
/cvsroot/zile/zile/src/glue.c	2001-01-19 23:02:18.0	ssigala	1.1	0	0	branches:  1.1.1;Initial revision
/cvsroot/zile/zile/src/glue.c	2001-01-19 23:08:08.0	ssigala	1.1.1.2	4	60	import of version 1.3.
/cvsroot/zile/zile/src/glue.c	2001-01-19 23:02:18.0	ssigala	1.1.1.1	0	0	import of version 1.4.
/cvsroot/zile/zile/src/Attic/hash.c	2003-05-06 14:46:09.0	rrt	1.2	1	1	These files shouldn&apos;t be here any more, they&apos;re replaced by htable in lib/.
/cvsroot/zile/zile/src/Attic/hash.c	2001-01-19 23:02:19.0	ssigala	1.1	0	0	branches:  1.1.1;Initial revision
/cvsroot/zile/zile/src/Attic/hash.c	2001-01-19 23:08:08.0	ssigala	1.1.1.2	2	2	import of version 1.3.
/cvsroot/zile/zile/src/Attic/hash.c	2001-01-19 23:02:19.0	ssigala	1.1.1.1	0	0	import of version 1.4.
/cvsroot/zile/zile/src/Attic/hash.h	2003-05-06 14:46:10.0	rrt	1.2	1	1	These files shouldn&apos;t be here any more, they&apos;re replaced by htable in lib/.
/cvsroot/zile/zile/src/Attic/hash.h	2001-01-19 23:02:21.0	ssigala	1.1	0	0	branches:  1.1.1;Initial revision
/cvsroot/zile/zile/src/Attic/hash.h	2001-01-19 23:08:08.0	ssigala	1.1.1.2	2	2	import of version 1.3.
/cvsroot/zile/zile/src/Attic/hash.h	2001-01-19 23:02:21.0	ssigala	1.1.1.1	0	0	import of version 1.4.
/cvsroot/zile/zile/src/help.c	2005-02-14 22:57:47.0	rrt	1.31	2	2	Change references to .zilerc to references to .zile.
/cvsroot/zile/zile/src/help.c	2005-02-07 02:36:44.0	rrt	1.30	17	9	Redefine DEFUN, FUNCALL and FUNCALL_ARG so that Zile commands are nowof type int (*f)(int argc, le *branch), i.e. almost of type eval_cb.Rename DEFUN to DEFUN_INT.Now arbitrary arguments can be passed by Lisp to Zile commands (intheory). This will require a new DEFUN macro.
/cvsroot/zile/zile/src/help.c	2005-01-31 00:24:34.0	rrt	1.29	2	1	Implement name-last-kbd-macro.Reorder extern.h to get more files in alphabetical order.Add get_macro and call_macro.
/cvsroot/zile/zile/src/help.c	2005-01-27 00:04:47.0	rrt	1.28	4	3	Add a buffer-local variable list to the Buffer struct, and move thetwo buffer-local variables (fill-column and tab-width) into it. Removetab_width and fill_column.Add tab_width to return a &quot;safe&quot; tab width, i.e. at least 1.Add get_variable_bp to get a variable for a particular buffer,get_variable_number to get a variable&apos;s value as a number, andget_variable_number_bp.Add variableSetNumber.Reduce the number of calls to read the value of tab-width where thisis easy.Make describe-variable get the value for the current buffer for abuffer-local variable.Improve doc strings for newline-and-indent and indent-command.
/cvsroot/zile/zile/src/help.c	2005-01-23 19:39:03.0	rrt	1.27	1	3	Remove test for limits.h, it&apos;s a standard ISO/ANSI header file.Some code and comment reformatting, including a couple of docstringimprovements.
/cvsroot/zile/zile/src/help.c	2005-01-14 17:56:57.0	rrt	1.26	2	3	Remove sanity_checks from main.c and replace it with an intelligentget_home_dir in file.c.A first, very dumb, implementation of -e in main.c (it should reallybe called -l, and will be).
/cvsroot/zile/zile/src/help.c	2005-01-12 11:55:33.0	rrt	1.25	3	3	Rename help-faq to view-zile-FAQ and help-tutorial tohelp-with-tutorial for consistency with Emacs.
/cvsroot/zile/zile/src/help.c	2005-01-10 00:56:04.0	rrt	1.24	164	164	Since I currently seem to be the only person contributing code toZile, it seems reasonable to have the code formatted as I like it.Hence, reformat to 2-space columns rather than 8-space. Ah...that&apos;sbetter!
/cvsroot/zile/zile/src/help.c	2004-12-20 12:15:38.0	rrt	1.23	3	2	branches:  1.23.2;Make minibuf_write update the screen (this won&apos;t slow things down muchand avoids having to remember to call it).This fixes an unreported bug where describe-key would not display&quot;Which key:&quot; correctly.
/cvsroot/zile/zile/src/help.c	2004-11-14 22:34:56.0	rrt	1.22	1	111	Remove minihelp files and functions. They are a pain to maintain,they&apos;re not Emacs-like, and this editor is not designed for novices(who should use nano or something similar).
/cvsroot/zile/zile/src/help.c	2004-11-14 22:05:04.0	rrt	1.21	2	2	Fix a bug in fix_alternative_keys.
/cvsroot/zile/zile/src/help.c	2004-10-16 22:36:50.0	rrt	1.20	1	9	Remove LATEST_VERSION and associated command and replace it with aquestion in the FAQ.
/cvsroot/zile/zile/src/help.c	2004-10-06 18:32:19.0	rrt	1.19	6	6	Change Line structure so that the text member is an astr. This meansthat the malloc system is worked a bit harder, but that line pointersdon&apos;t need to be twiddled when the length of a line changes, and thatthe code is simplified (we make far more use of standard astrroutines).As well as general code simplification, this should make instantdisplay updating easier to program.These changes are potentially capable of introducing bugs, but initialtests with simple editing have run cleanly in valgrind.Other misc cleanup, and further experimentation in term_termcap.c(which is still far from finished).
/cvsroot/zile/zile/src/help.c	2004-05-09 20:01:57.0	rrt	1.18	2	3	Remove EOB marker. It&apos;s a frivolous feature.
/cvsroot/zile/zile/src/help.c	2004-04-23 22:41:40.0	rrt	1.17	2	2	Rename astr_size to astr_len.
/cvsroot/zile/zile/src/help.c	2004-04-05 15:27:44.0	rrt	1.16	3	21	Tidy up implementation of global-set-key.Make a few messages more Emacs-like.Remove describe-key-briefly: describe-key is fine.Note: there&apos;s now a function keyvectostr to turn a list of key chordsinto a string.
/cvsroot/zile/zile/src/help.c	2004-03-30 00:47:01.0	rrt	1.15	6	6	Rename some string functions to more ISO standard-like names, e.g.astr_assign* becomes astr_cpy* and astr_append* becomes astr_cat*.They are shorter too!Also add getln (safe gets, I should probably call it agets!) toglue.c, in preparation for the Lisp interpreter, which is takingshape in my working copy.
/cvsroot/zile/zile/src/help.c	2004-03-13 17:31:20.0	rrt	1.14	23	20	Make astr_fgets allocate its result, and return an empty string ratherthan NULL when eof is reached.Get rid of astr_fmt and astr_vfmt.
/cvsroot/zile/zile/src/help.c	2004-03-11 14:50:14.0	rrt	1.13	2	2	Yet more underused and unused functions removed from astr.c. I&apos;ve alsostarted transferring the documentation from astr.3 to astr.h: sincethese are not general purpose libraries but just code for zile now,there&apos;s no point having man pages. The man page is now ratherbutchered, and probably not valid troff; it will soon disappear.I have made small changes to several other files to work aroundfunctions I have removed. I have also tidied up the code in one or twoinstances. The new code is hardly ever longer than the old, and makesthe astr library much easier to understand (it&apos;s now about half thesize of the original API).
/cvsroot/zile/zile/src/help.c	2004-03-10 14:27:14.0	rrt	1.12	2	2	Remove more rarely used and unused functions from astr.
/cvsroot/zile/zile/src/help.c	2004-02-18 00:20:33.0	rrt	1.11	4	2	Add copyright lines for Reuben Thomas.
/cvsroot/zile/zile/src/help.c	2004-02-17 21:21:18.0	ssigala	1.10	20	24	* Changed BSD license to GNU GPL:        - Removed COPYRIGHT file        - Added standard COPYING file        - Changed all the copyright declarations in source files.* Removed old lib/err.[ch] unused Zile heritage.* sed s/sandro@sigala.it/zile-devel@lists.sourceforge.net/* configure now checks for both curses.h and ncurses.h, libcurses.a and  libncurses.a.  e.g. on my box (SuSE 8.2) ncurses is installed as  ncurses.h and libncurses.a, on another as curses.h and libncurses.a...* Cleaned up zile.h:          - Now anchors are identified as an opaque type:                 typedef unsigned char Anchor;          - Enumerated UNDO_* delta types;          - Enumerated BMODE_* buffer major modes;          - Removed MINIBUF_{SET,UNSET}_COLOR stuff.* ncurses_minibuf.c:  removed astrlen() function, obsoleted by colors remove.* some other clean up.
/cvsroot/zile/zile/src/help.c	2004-02-14 11:14:01.0	dacap	1.9	7	7	Removed color support from minibuf.
/cvsroot/zile/zile/src/help.c	2004-02-08 05:39:26.0	dacap	1.8	9	14	Rewritten point/marker API mainly.
/cvsroot/zile/zile/src/help.c	2004-01-29 08:23:10.0	rrt	1.7	3	4	Use VERSION from automake, not version.h.
/cvsroot/zile/zile/src/help.c	2003-10-25 01:32:08.0	ssigala	1.6	2	2	* minor fixes to expand_path().* fixed memory leak in usage of agetcwd().  Now agetcwd() also uses a  previously allocated astr to store the directory name (simplifies  the code).* fixed problem about relative directories, when zile is called  with filenames on the command line (e.g., `zile term_ncurses/*.c&apos;  now works correctly).* introduced astr_isempty(), astr_first_char(), astr_last_char() sugar  functions.  &quot;astr_last_char(as)&quot; is certainly better than the ugly  &quot;astr_cstr(as)[astr_size(as) - 1]&quot;.* introduced ZTRACE() function to make debugging easier.* renamed ANCHOR_SPECIAL to ANCHOR_HEREDOC because  cat &lt;&lt;EOF  bla  EOF  stuff is usually called here-document.* renamed `font-special&apos; variable to `font-here-document&apos;.* added `font-here-document&apos; to tbl_vars.h, zilerc.sample and Texinfo.* redisplay speedup: cache a few more variables:  status-line-color, display-time-format, displayable-characters.* startup speedup: do not cache the variables too ofter.* made make_heredoc_string more flexible.* fixed zlint.* documented `sh-mode&apos;, `kill-word&apos;, `backward-kill-word&apos; in Texinfo.* other fixes.
/cvsroot/zile/zile/src/help.c	2003-05-19 23:50:25.0	rrt	1.5	17	18	Sandro suggested replacing pathbuffer_t with astr. This set of patchesis the rather ugly result, although it&apos;s not as bad as it looks: lotsof the changes are just making char * --&gt; const char *. One or twoinfelicities, such as the fact that one history method now take anastr, while another still takes a char *, need fixing. Since I proposeto carry on cleaning up the code generally, that shouldn&apos;t be too muchof a problem.However, this set of changes definitely validates the decision to gofor a 1.6.2 release before releasing 1.7! 1.7 may now take a littlewhile to stabilise.
/cvsroot/zile/zile/src/help.c	2003-05-07 00:28:42.0	rrt	1.4	26	8	Land the 1.7 sources. This is basically 1.7-a7 (unreleased except onSandro&apos;s home page) plus my and Nicolas Duboc&apos;s 1.6.2 fixes, plus somepatches to 1.7-a6 from David Capello.
/cvsroot/zile/zile/src/help.c	2003-04-24 17:36:50.0	rrt	1.3	21	13	Fix compilation on GNU/HURD. Patch from Nicolas Duboc [nicolas@duboc.net]
/cvsroot/zile/zile/src/help.c	2003-04-24 17:11:59.0	rrt	1.2	149	78	Committing 1.6.2 sources.
/cvsroot/zile/zile/src/help.c	2001-01-19 23:02:23.0	ssigala	1.1	0	0	branches:  1.1.1;Initial revision
/cvsroot/zile/zile/src/help.c	2001-01-19 23:08:09.0	ssigala	1.1.1.2	10	10	import of version 1.3.
/cvsroot/zile/zile/src/help.c	2001-01-19 23:02:23.0	ssigala	1.1.1.1	0	0	import of version 1.4.
/cvsroot/zile/zile/src/help.c	2005-01-26 16:17:22.0	rrt	1.23.2.1	1	3	There are no code changes since 2.0beta9.Bump version to 2.0beta10.Remove irrelevant bits from configure.ac as on HEAD.Fix use of vasprintf.c and strrstr.c: don&apos;t compile them when they&apos;renot needed, but make sure to include both in the distribution.Fix use of AC_REPLACE_FUNCS.
/cvsroot/zile/zile/src/history.c	2005-01-10 00:56:04.0	rrt	1.7	48	48	Since I currently seem to be the only person contributing code toZile, it seems reasonable to have the code formatted as I like it.Hence, reformat to 2-space columns rather than 8-space. Ah...that&apos;sbetter!
/cvsroot/zile/zile/src/history.c	2005-01-09 19:11:13.0	rrt	1.6	26	29	Replace the list implementation. The new implementation is mine, andalthough its publically released form (rrtlib) is unstable, thisparticular library is small and has been used several times indifferent projects and can be considered mature.The new implmentation is better because:1. It is smaller and simpler.2. The new lists are stateless (do not store a position during list   traversal).3. The new list type can replace Line (they&apos;re basically the same   type).3. The new lists are manipulated entirely via the API, so that in   particular the next and prev links won&apos;t be corrupted by sloppy   programming, and check_list in main is made redundant (once the   list type has been used to replace Line).Remove spurious vsprintf from minibuf_format (which just repeated thework of the preceding vasprintf).Factor most of minibuf_write and minibuf_error into minibuf_vwrite;this also fixes the bug that minibuf_error now refreshes the terminal.Remove redundant term_refresh calls after minibuf_write andminibuf_error, which already call it.
/cvsroot/zile/zile/src/history.c	2005-01-08 23:41:34.0	rrt	1.5	3	3	Fix some bad spacing.
/cvsroot/zile/zile/src/history.c	2004-03-09 17:19:11.0	rrt	1.4	2	1	#include string.h for mem* functions.
/cvsroot/zile/zile/src/history.c	2004-02-18 17:21:54.0	ssigala	1.3	2	2	minor tweaks
/cvsroot/zile/zile/src/history.c	2004-02-17 21:21:18.0	ssigala	1.2	20	24	* Changed BSD license to GNU GPL:        - Removed COPYRIGHT file        - Added standard COPYING file        - Changed all the copyright declarations in source files.* Removed old lib/err.[ch] unused Zile heritage.* sed s/sandro@sigala.it/zile-devel@lists.sourceforge.net/* configure now checks for both curses.h and ncurses.h, libcurses.a and  libncurses.a.  e.g. on my box (SuSE 8.2) ncurses is installed as  ncurses.h and libncurses.a, on another as curses.h and libncurses.a...* Cleaned up zile.h:          - Now anchors are identified as an opaque type:                 typedef unsigned char Anchor;          - Enumerated UNDO_* delta types;          - Enumerated BMODE_* buffer major modes;          - Removed MINIBUF_{SET,UNSET}_COLOR stuff.* ncurses_minibuf.c:  removed astrlen() function, obsoleted by colors remove.* some other clean up.
/cvsroot/zile/zile/src/history.c	2004-02-08 05:39:26.0	dacap	1.1	0	0	Rewritten point/marker API mainly.
/cvsroot/zile/zile/src/Attic/htable.c	2005-01-22 12:30:14.0	rrt	1.6	1	1	Remove htable, as it&apos;s no longer used (was only used by variableimplementation).
/cvsroot/zile/zile/src/Attic/htable.c	2005-01-10 02:31:53.0	rrt	1.5	3	3	Use new Line struct, which is just a typedef for list_s.Rename the limitp member of Buffer to lines.
