file	tstamp	developer	version	lines_add	lines_del	description
/cvsroot/zile/zile/src/tbl_vars.h	2004-02-17 21:21:18.0	ssigala	1.6	1	25	* Changed BSD license to GNU GPL:        - Removed COPYRIGHT file        - Added standard COPYING file        - Changed all the copyright declarations in source files.* Removed old lib/err.[ch] unused Zile heritage.* sed s/sandro@sigala.it/zile-devel@lists.sourceforge.net/* configure now checks for both curses.h and ncurses.h, libcurses.a and  libncurses.a.  e.g. on my box (SuSE 8.2) ncurses is installed as  ncurses.h and libncurses.a, on another as curses.h and libncurses.a...* Cleaned up zile.h:          - Now anchors are identified as an opaque type:                 typedef unsigned char Anchor;          - Enumerated UNDO_* delta types;          - Enumerated BMODE_* buffer major modes;          - Removed MINIBUF_{SET,UNSET}_COLOR stuff.* ncurses_minibuf.c:  removed astrlen() function, obsoleted by colors remove.* some other clean up.
/cvsroot/zile/zile/src/tbl_vars.h	2004-02-08 05:39:26.0	dacap	1.5	13	4	Rewritten point/marker API mainly.
/cvsroot/zile/zile/src/tbl_vars.h	2003-10-25 01:32:09.0	ssigala	1.4	5	2	* minor fixes to expand_path().* fixed memory leak in usage of agetcwd().  Now agetcwd() also uses a  previously allocated astr to store the directory name (simplifies  the code).* fixed problem about relative directories, when zile is called  with filenames on the command line (e.g., `zile term_ncurses/*.c&apos;  now works correctly).* introduced astr_isempty(), astr_first_char(), astr_last_char() sugar  functions.  &quot;astr_last_char(as)&quot; is certainly better than the ugly  &quot;astr_cstr(as)[astr_size(as) - 1]&quot;.* introduced ZTRACE() function to make debugging easier.* renamed ANCHOR_SPECIAL to ANCHOR_HEREDOC because  cat &lt;&lt;EOF  bla  EOF  stuff is usually called here-document.* renamed `font-special&apos; variable to `font-here-document&apos;.* added `font-here-document&apos; to tbl_vars.h, zilerc.sample and Texinfo.* redisplay speedup: cache a few more variables:  status-line-color, display-time-format, displayable-characters.* startup speedup: do not cache the variables too ofter.* made make_heredoc_string more flexible.* fixed zlint.* documented `sh-mode&apos;, `kill-word&apos;, `backward-kill-word&apos; in Texinfo.* other fixes.
/cvsroot/zile/zile/src/tbl_vars.h	2003-05-07 00:28:42.0	rrt	1.3	35	2	Land the 1.7 sources. This is basically 1.7-a7 (unreleased except onSandro&apos;s home page) plus my and Nicolas Duboc&apos;s 1.6.2 fixes, plus somepatches to 1.7-a6 from David Capello.
/cvsroot/zile/zile/src/tbl_vars.h	2003-04-24 17:11:59.0	rrt	1.2	18	15	Committing 1.6.2 sources.
/cvsroot/zile/zile/src/tbl_vars.h	2001-01-19 23:02:51.0	ssigala	1.1	0	0	branches:  1.1.1;Initial revision
/cvsroot/zile/zile/src/tbl_vars.h	2001-01-19 23:08:14.0	ssigala	1.1.1.2	36	77	import of version 1.3.
/cvsroot/zile/zile/src/tbl_vars.h	2001-01-19 23:02:51.0	ssigala	1.1.1.1	0	0	import of version 1.4.
/cvsroot/zile/zile/src/term_allegro.c	2005-02-05 14:32:41.0	rrt	1.26	3	3	There is no zcalloc, use zmalloc instead.
/cvsroot/zile/zile/src/term_allegro.c	2005-02-05 03:01:40.0	rrt	1.25	3	3	Use zcalloc, not calloc.
/cvsroot/zile/zile/src/term_allegro.c	2005-02-05 02:49:15.0	rrt	1.24	11	9	Make interactive commands work in macro; fixes #1088414 (again...).Rename term_getkey --&gt; getkey, and add xgetkey, defined in terms ofit.Move macro handling code from term_xgetkey in term_termcap.c toxgetkey (which is in glue.c).Rename GETKEY_NONFILTERED to GETKEY_UNFILTERED.
/cvsroot/zile/zile/src/term_allegro.c	2005-02-03 03:17:01.0	rrt	1.23	32	35	Fix compiler warnings in term_allegro.c, and make sure cursor iscorrectly positioned in all terminals; add term_redraw_cursor to thisend.
/cvsroot/zile/zile/src/term_allegro.c	2005-01-30 03:43:25.0	dacap	1.22	14	13	Fixed some outdated compilation errors.
/cvsroot/zile/zile/src/term_allegro.c	2005-01-27 02:33:18.0	rrt	1.21	10	10	For simplicity, change unsigned and unsigned long to size_t.
/cvsroot/zile/zile/src/term_allegro.c	2005-01-27 00:58:52.0	rrt	1.20	6	6	Change term_xgetkey&apos;s second arg to unsigned to avoid -Wconversionwarnings.
/cvsroot/zile/zile/src/term_allegro.c	2005-01-27 00:45:00.0	rrt	1.19	2	2	Fix -Wconversion warnings in term_redisplay.c, and fix other placesthat this affects.Change &quot;unsigned int&quot; to &quot;unsigned&quot;.
/cvsroot/zile/zile/src/term_allegro.c	2005-01-25 19:01:27.0	rrt	1.18	2	2	Fix key processing (#109179) by unbuffering stdin, and make the keybuffer a dynamic string rather than a fixed-size buffer.Rename term_unget to term_ungetkey for consistency.
/cvsroot/zile/zile/src/term_allegro.c	2005-01-18 13:25:45.0	rrt	1.17	11	8	Move term_addnstr to term_redisplay, as it&apos;s generic.Add default (empty!) implementations of term_suspend and term_resumeto the other terminal types.
/cvsroot/zile/zile/src/term_allegro.c	2005-01-18 13:06:15.0	rrt	1.16	1	13	Move term_printw to term_redisplay, because it&apos;s generic.Add term_suspend and term_resume (incomplete) to term_termcap.c.
/cvsroot/zile/zile/src/term_allegro.c	2005-01-18 00:07:12.0	rrt	1.15	1	6	Remove unused font codes (ZA_* symbols).
/cvsroot/zile/zile/src/term_allegro.c	2005-01-16 14:04:58.0	rrt	1.14	4	5	Allow KBD_NOKEY to be passed to term_unget, and ignore it.
/cvsroot/zile/zile/src/term_allegro.c	2005-01-14 23:31:49.0	rrt	1.13	4	4	Reformat some ?: operators for consistency.
/cvsroot/zile/zile/src/term_allegro.c	2005-01-12 00:13:07.0	rrt	1.12	3	3	Give an error if the screen mode cannot be set.
/cvsroot/zile/zile/src/term_allegro.c	2005-01-10 00:56:06.0	rrt	1.11	226	226	Since I currently seem to be the only person contributing code toZile, it seems reasonable to have the code formatted as I like it.Hence, reformat to 2-space columns rather than 8-space. Ah...that&apos;sbetter!
/cvsroot/zile/zile/src/term_allegro.c	2004-11-15 23:19:45.0	rrt	1.10	1	7	branches:  1.10.2;Factor code to tidy up the display into main.c; it&apos;s independent ofthe terminal.Similarly, call free_rotation_buffers from main.
/cvsroot/zile/zile/src/term_allegro.c	2004-11-14 17:29:07.0	rrt	1.9	2	2	Rename term_unget_char to term_unget (it really does unget akeystroke, not a char).
/cvsroot/zile/zile/src/term_allegro.c	2004-10-25 01:56:33.0	rrt	1.8	3	5	Fix term_unget_char not to return anything, as per new prototype.
/cvsroot/zile/zile/src/term_allegro.c	2004-10-16 22:19:13.0	rrt	1.7	2	2	Rename term_ungetkey to the more accurate term_unget_char.Redo ungetkey support in term_termcap.c to cope with fast input.In extern.h reflect change to meaning of waitkey functions.
/cvsroot/zile/zile/src/term_allegro.c	2004-10-13 17:52:19.0	rrt	1.6	1	6	term_read_screen_size doesn&apos;t need to be in the API.
/cvsroot/zile/zile/src/term_allegro.c	2004-10-13 17:50:17.0	rrt	1.5	6	1	Make window resizing work for termcap.
/cvsroot/zile/zile/src/term_allegro.c	2004-10-11 02:57:48.0	rrt	1.4	1	6	Remove unused term_open function.
/cvsroot/zile/zile/src/term_allegro.c	2004-10-08 15:30:45.0	rrt	1.3	29	82	Remove colour support.Simplify the terminal interface further. The per-interface header fileis no longer required.Start rewriting the termcap back-end so that it can have a simplencurses-like optimisation and not have to redraw the entire screenevery time.
/cvsroot/zile/zile/src/term_allegro.c	2004-09-20 16:22:07.0	rrt	1.2	10	3	Make term_attrset vararg, so it will cope with both allegro/cursesstyle of attributes (all set at once) and termcap style (cumulative).Reverse video is now working in the termcap terminal!
/cvsroot/zile/zile/src/term_allegro.c	2004-09-03 04:09:08.0	dacap	1.1	0	0	Added the Allegro interface.
/cvsroot/zile/zile/src/term_allegro.c	2005-02-03 03:20:50.0	rrt	1.10.2.1	8	7	Backport David Capello&apos;s term_allegro fixes from CVS HEAD.
/cvsroot/zile/zile/src/Attic/term_allegro.h	2004-10-08 15:30:45.0	rrt	1.3	1	1	Remove colour support.Simplify the terminal interface further. The per-interface header fileis no longer required.Start rewriting the termcap back-end so that it can have a simplencurses-like optimisation and not have to redraw the entire screenevery time.
/cvsroot/zile/zile/src/Attic/term_allegro.h	2004-09-20 15:38:14.0	rrt	1.2	6	1	Define Font type in each term_*.h. Hence, need to #include zterm.h inzile.h. In term_termcap, Font is typedef&apos;d to char *.Add ZILE_NORMAL font. Since termcap uses the idea of turningattributes on and off rather than applying them to each character, weneed to move to this model.
/cvsroot/zile/zile/src/Attic/term_allegro.h	2004-09-03 04:09:08.0	dacap	1.1	0	0	Added the Allegro interface.
/cvsroot/zile/zile/src/term_epocemx.c	2005-02-05 02:49:15.0	rrt	1.13	4	4	Make interactive commands work in macro; fixes #1088414 (again...).Rename term_getkey --&gt; getkey, and add xgetkey, defined in terms ofit.Move macro handling code from term_xgetkey in term_termcap.c toxgetkey (which is in glue.c).Rename GETKEY_NONFILTERED to GETKEY_UNFILTERED.
/cvsroot/zile/zile/src/term_epocemx.c	2005-01-31 00:24:34.0	rrt	1.12	5	5	Implement name-last-kbd-macro.Reorder extern.h to get more files in alphabetical order.Add get_macro and call_macro.
/cvsroot/zile/zile/src/term_epocemx.c	2005-01-27 02:33:18.0	rrt	1.11	4	4	For simplicity, change unsigned and unsigned long to size_t.
/cvsroot/zile/zile/src/term_epocemx.c	2005-01-27 00:58:52.0	rrt	1.10	2	2	Change term_xgetkey&apos;s second arg to unsigned to avoid -Wconversionwarnings.
/cvsroot/zile/zile/src/term_epocemx.c	2005-01-27 00:45:00.0	rrt	1.9	3	3	Fix -Wconversion warnings in term_redisplay.c, and fix other placesthat this affects.Change &quot;unsigned int&quot; to &quot;unsigned&quot;.
/cvsroot/zile/zile/src/term_epocemx.c	2005-01-25 19:01:27.0	rrt	1.8	2	2	Fix key processing (#109179) by unbuffering stdin, and make the keybuffer a dynamic string rather than a fixed-size buffer.Rename term_unget to term_ungetkey for consistency.
/cvsroot/zile/zile/src/term_epocemx.c	2005-01-18 13:25:45.0	rrt	1.7	11	8	Move term_addnstr to term_redisplay, as it&apos;s generic.Add default (empty!) implementations of term_suspend and term_resumeto the other terminal types.
/cvsroot/zile/zile/src/term_epocemx.c	2005-01-18 13:06:15.0	rrt	1.6	1	14	Move term_printw to term_redisplay, because it&apos;s generic.Add term_suspend and term_resume (incomplete) to term_termcap.c.
/cvsroot/zile/zile/src/term_epocemx.c	2005-01-17 19:15:38.0	rrt	1.5	1	3	Remove ZILE_BOLD, which is no longer used.
/cvsroot/zile/zile/src/term_epocemx.c	2005-01-16 14:04:58.0	rrt	1.4	2	2	Allow KBD_NOKEY to be passed to term_unget, and ignore it.
/cvsroot/zile/zile/src/term_epocemx.c	2005-01-10 00:56:06.0	rrt	1.3	235	235	Since I currently seem to be the only person contributing code toZile, it seems reasonable to have the code formatted as I like it.Hence, reformat to 2-space columns rather than 8-space. Ah...that&apos;sbetter!
/cvsroot/zile/zile/src/term_epocemx.c	2005-01-05 23:52:00.0	rrt	1.2	4	4	Fix a bug in term_refresh which led to far too many cursor updates,making screen refresh very slow on slow links and slow machines.
/cvsroot/zile/zile/src/term_epocemx.c	2004-11-16 01:35:44.0	rrt	1.1	0	0	Add EPOC support (in term_epocemx.c).Add --enable-epocemx to configure.acRemove gperf test from configure.ac.Note: term_epocemx.c currently duplicates quite a lot ofterm_termcap.c, of which it is a heavily modified version. I willfactor out the comon bits shortly.Also, building under epocemx requires a configure line something like:./configure --build=&lt;current-platform&gt; --host=arm-epoc-pe --enable-epocemx
/cvsroot/zile/zile/src/term_minibuf.c	2005-02-05 02:49:15.0	rrt	1.19	2	2	Make interactive commands work in macro; fixes #1088414 (again...).Rename term_getkey --&gt; getkey, and add xgetkey, defined in terms ofit.Move macro handling code from term_xgetkey in term_termcap.c toxgetkey (which is in glue.c).Rename GETKEY_NONFILTERED to GETKEY_UNFILTERED.
/cvsroot/zile/zile/src/term_minibuf.c	2005-01-29 13:21:00.0	rrt	1.18	4	4	Fix unsigned vs signed comparison warnings.
/cvsroot/zile/zile/src/term_minibuf.c	2005-01-27 02:33:18.0	rrt	1.17	4	4	For simplicity, change unsigned and unsigned long to size_t.
/cvsroot/zile/zile/src/term_minibuf.c	2005-01-27 00:49:58.0	rrt	1.16	7	6	Fix -Wconversion warnings in term_minibuf.c.
/cvsroot/zile/zile/src/term_minibuf.c	2005-01-12 01:16:53.0	rrt	1.15	4	4	Simplify zap_buffer_content massively.Remove the unused argument from completion_scroll_{up,down}.Improve error messages in new_buffer.Fix // expansion in expand_path (thanks, Nicolas Duboc for reportingthe problem, which is also fixed in 2.0).Remove redundant memset from new_buffer.
/cvsroot/zile/zile/src/term_minibuf.c	2005-01-10 00:56:06.0	rrt	1.14	283	283	Since I currently seem to be the only person contributing code toZile, it seems reasonable to have the code formatted as I like it.Hence, reformat to 2-space columns rather than 8-space. Ah...that&apos;sbetter!
/cvsroot/zile/zile/src/term_minibuf.c	2004-12-20 14:17:25.0	rrt	1.13	2	2	Add a flag to completion_try, popup_when_complete that signals if wewant the *Completions* window even when the string supplied is alreadycomplete (i.e. when it is both a completion and a prefix of some othercompletion(s)). We want to pop up the completions list in this caseonly when completions were expressly requested by pressing TAB.In fact completion_try should really be factored into two functions,one of which deals with the screen and the other of which looks forcompletions.
/cvsroot/zile/zile/src/term_minibuf.c	2004-12-20 13:48:53.0	rrt	1.12	13	10	Get rid of action functions for completions; at the moment we onlyhave one (the default action), and frankly YAGNI.
/cvsroot/zile/zile/src/term_minibuf.c	2004-10-12 01:32:16.0	rrt	1.11	17	20	Fix another bug, this time when the minibuffer contents is longer thanthe width of the screen.
/cvsroot/zile/zile/src/term_minibuf.c	2004-10-12 00:10:18.0	rrt	1.10	5	3	Fix drawing of minibuffer. In draw_minibuffer_read, call term_refreshto update the screen after drawing the minibuffer. When callingterm_addnstr, make sure we don&apos;t try to add more characters than arein the string (i.e. it&apos;s not like strncat, but always adds the givennumber of characters).
/cvsroot/zile/zile/src/term_minibuf.c	2004-10-08 15:30:45.0	rrt	1.9	4	5	Remove colour support.Simplify the terminal interface further. The per-interface header fileis no longer required.Start rewriting the termcap back-end so that it can have a simplencurses-like optimisation and not have to redraw the entire screenevery time.
/cvsroot/zile/zile/src/term_minibuf.c	2004-07-11 02:29:37.0	rrt	1.8	4	24	Get rid of term_minibuf_clear, and replace it withterm_minibuf_write(&quot;&quot;), which is functionally identical.Get rid of term_getyx, as it can&apos;t be implemented in termcap (I wasusing the ncurses getyx call, which returned nonsense results).Fix a bug in term_addnstr in term_termcap.c.Comment:It seems that not calling term_getyx to save the position of thecursor when writing to the minibuffer has caused no ill effects, but Icould be wrong; something to watch out for...The display now seems basically to work under termcap, as the changeschecked in here fix the minibuffer.
/cvsroot/zile/zile/src/term_minibuf.c	2004-07-11 01:52:45.0	rrt	1.7	6	7	Marginal tidy up.
/cvsroot/zile/zile/src/term_minibuf.c	2004-07-01 00:52:41.0	rrt	1.6	2	2	Add support for different implementations of the terminal interface,and add preliminary term.h/termio.h interface. The default interfaceis still curses, and it can be disabled with --disable-curses passedto configure.zterm.h is now the header included by C files, which in turn includesthe implementation header, currently either term_ncurses.h orterm_termcap.h.
/cvsroot/zile/zile/src/term_minibuf.c	2004-05-21 00:34:50.0	rrt	1.5	2	2	Get rid of the function pointers from the Terminal type; we have nodesire to make a binary of zile that can use more than one sort ofterminal. (This doesn&apos;t stop us choosing at compile-time, of course!)
/cvsroot/zile/zile/src/term_minibuf.c	2004-05-21 00:13:53.0	rrt	1.4	5	5	Expunge ncurses_* functions from files other than term_ncurses.c.Mostly this was done by simply renaming them after ensuring that theycalled no ncurses functions directly. Now all ncurses code definitelylives in term_ncurses.c (unless I have made a mistake).
/cvsroot/zile/zile/src/term_minibuf.c	2004-05-20 23:48:40.0	rrt	1.3	11	7	Remove term_mv* and term_addstr and replace them with equivalent code.The aim is to make the API that needs to be reimplemented for termiosupport rather smaller.
/cvsroot/zile/zile/src/term_minibuf.c	2004-05-10 18:49:50.0	rrt	1.2	2	2	Move contents of ncurses_key.c into term_ncurses.c. Get rid of theterm_ncurses subdirectory altogether. We now have just oneterm_foo.{c,h} file per Terminal implementation, and a number ofterm_*.c files that build on top of this. In fact, this storyis about to get a whole lot simpler too.
/cvsroot/zile/zile/src/term_minibuf.c	2004-05-09 20:31:07.0	rrt	1.1	0	0	Move term_ncurses/ncurses_minibuf.c to term_minibuf.c.
/cvsroot/zile/zile/src/Attic/term_ncurses.c	2004-10-11 03:08:42.0	rrt	1.12	1	1	Remove ncurses interface. We no longer have any dependencies onexternal libraries!
/cvsroot/zile/zile/src/Attic/term_ncurses.c	2004-10-08 15:30:45.0	rrt	1.11	27	67	Remove colour support.Simplify the terminal interface further. The per-interface header fileis no longer required.Start rewriting the termcap back-end so that it can have a simplencurses-like optimisation and not have to redraw the entire screenevery time.
/cvsroot/zile/zile/src/Attic/term_ncurses.c	2004-09-20 16:22:07.0	rrt	1.10	10	3	Make term_attrset vararg, so it will cope with both allegro/cursesstyle of attributes (all set at once) and termcap style (cumulative).Reverse video is now working in the termcap terminal!
/cvsroot/zile/zile/src/Attic/term_ncurses.c	2004-09-20 15:42:59.0	rrt	1.9	4	2	Define ZILE_NORMAL.
/cvsroot/zile/zile/src/Attic/term_ncurses.c	2004-07-11 02:29:37.0	rrt	1.8	1	6	Get rid of term_minibuf_clear, and replace it withterm_minibuf_write(&quot;&quot;), which is functionally identical.Get rid of term_getyx, as it can&apos;t be implemented in termcap (I wasusing the ncurses getyx call, which returned nonsense results).Fix a bug in term_addnstr in term_termcap.c.Comment:It seems that not calling term_getyx to save the position of thecursor when writing to the minibuffer has caused no ill effects, but Icould be wrong; something to watch out for...The display now seems basically to work under termcap, as the changeschecked in here fix the minibuffer.
/cvsroot/zile/zile/src/Attic/term_ncurses.c	2004-07-01 00:52:41.0	rrt	1.7	9	9	Add support for different implementations of the terminal interface,and add preliminary term.h/termio.h interface. The default interfaceis still curses, and it can be disabled with --disable-curses passedto configure.zterm.h is now the header included by C files, which in turn includesthe implementation header, currently either term_ncurses.h orterm_termcap.h.
/cvsroot/zile/zile/src/Attic/term_ncurses.c	2004-05-29 18:38:43.0	rrt	1.6	2	2	A few small bits of twiddling to make the term interface tidier, andfix bug 962722 (selection highlighting broken).
/cvsroot/zile/zile/src/Attic/term_ncurses.c	2004-05-23 23:47:20.0	rrt	1.5	1	5	Remove comment about exports that is no longer true.
/cvsroot/zile/zile/src/Attic/term_ncurses.c	2004-05-21 00:34:50.0	rrt	1.4	5	21	Get rid of the function pointers from the Terminal type; we have nodesire to make a binary of zile that can use more than one sort ofterminal. (This doesn&apos;t stop us choosing at compile-time, of course!)
/cvsroot/zile/zile/src/Attic/term_ncurses.c	2004-05-21 00:13:53.0	rrt	1.3	10	12	Expunge ncurses_* functions from files other than term_ncurses.c.Mostly this was done by simply renaming them after ensuring that theycalled no ncurses functions directly. Now all ncurses code definitelylives in term_ncurses.c (unless I have made a mistake).
/cvsroot/zile/zile/src/Attic/term_ncurses.c	2004-05-20 23:48:40.0	rrt	1.2	1	16	Remove term_mv* and term_addstr and replace them with equivalent code.The aim is to make the API that needs to be reimplemented for termiosupport rather smaller.
/cvsroot/zile/zile/src/Attic/term_ncurses.c	2004-05-10 18:49:50.0	rrt	1.1	0	0	Move contents of ncurses_key.c into term_ncurses.c. Get rid of theterm_ncurses subdirectory altogether. We now have just oneterm_foo.{c,h} file per Terminal implementation, and a number ofterm_*.c files that build on top of this. In fact, this storyis about to get a whole lot simpler too.
/cvsroot/zile/zile/src/Attic/term_ncurses.h	2004-10-08 15:30:45.0	rrt	1.8	1	1	Remove colour support.Simplify the terminal interface further. The per-interface header fileis no longer required.Start rewriting the termcap back-end so that it can have a simplencurses-like optimisation and not have to redraw the entire screenevery time.
/cvsroot/zile/zile/src/Attic/term_ncurses.h	2004-09-20 15:38:14.0	rrt	1.7	6	2	Define Font type in each term_*.h. Hence, need to #include zterm.h inzile.h. In term_termcap, Font is typedef&apos;d to char *.Add ZILE_NORMAL font. Since termcap uses the idea of turningattributes on and off rather than applying them to each character, weneed to move to this model.
/cvsroot/zile/zile/src/Attic/term_ncurses.h	2004-07-01 00:52:41.0	rrt	1.6	2	2	Add support for different implementations of the terminal interface,and add preliminary term.h/termio.h interface. The default interfaceis still curses, and it can be disabled with --disable-curses passedto configure.zterm.h is now the header included by C files, which in turn includesthe implementation header, currently either term_ncurses.h orterm_termcap.h.
/cvsroot/zile/zile/src/Attic/term_ncurses.h	2004-05-29 18:38:43.0	rrt	1.5	1	2	A few small bits of twiddling to make the term interface tidier, andfix bug 962722 (selection highlighting broken).
/cvsroot/zile/zile/src/Attic/term_ncurses.h	2004-05-21 00:34:50.0	rrt	1.4	1	27	Get rid of the function pointers from the Terminal type; we have nodesire to make a binary of zile that can use more than one sort ofterminal. (This doesn&apos;t stop us choosing at compile-time, of course!)
/cvsroot/zile/zile/src/Attic/term_ncurses.h	2004-05-21 00:13:53.0	rrt	1.3	11	10	Expunge ncurses_* functions from files other than term_ncurses.c.Mostly this was done by simply renaming them after ensuring that theycalled no ncurses functions directly. Now all ncurses code definitelylives in term_ncurses.c (unless I have made a mistake).
/cvsroot/zile/zile/src/Attic/term_ncurses.h	2004-05-20 23:48:40.0	rrt	1.2	1	4	Remove term_mv* and term_addstr and replace them with equivalent code.The aim is to make the API that needs to be reimplemented for termiosupport rather smaller.
/cvsroot/zile/zile/src/Attic/term_ncurses.h	2004-05-10 18:49:50.0	rrt	1.1	0	0	Move contents of ncurses_key.c into term_ncurses.c. Get rid of theterm_ncurses subdirectory altogether. We now have just oneterm_foo.{c,h} file per Terminal implementation, and a number ofterm_*.c files that build on top of this. In fact, this storyis about to get a whole lot simpler too.
/cvsroot/zile/zile/src/term_redisplay.c	2005-02-05 14:49:06.0	rrt	1.39	9	9	Add zasprintf and zvasprintf to zmalloc.c.Remove asprintf from vasprintf.c (no longer needed).Fix compilation warnings in vasprintf.Use new functions.
/cvsroot/zile/zile/src/term_redisplay.c	2005-02-03 03:17:01.0	rrt	1.38	11	5	Fix compiler warnings in term_allegro.c, and make sure cursor iscorrectly positioned in all terminals; add term_redraw_cursor to thisend.
/cvsroot/zile/zile/src/term_redisplay.c	2005-01-29 13:17:19.0	rrt	1.37	5	4	Fix unsigned vs signed comparison warnings.
/cvsroot/zile/zile/src/term_redisplay.c	2005-01-27 02:33:18.0	rrt	1.36	19	19	For simplicity, change unsigned and unsigned long to size_t.
/cvsroot/zile/zile/src/term_redisplay.c	2005-01-27 02:27:24.0	rrt	1.35	4	4	Fix -Wconversion warnings.Make astr_truncate take a pos rather than a size.Fix setting of fill-column.
/cvsroot/zile/zile/src/term_redisplay.c	2005-01-27 00:45:00.0	rrt	1.34	26	26	Fix -Wconversion warnings in term_redisplay.c, and fix other placesthat this affects.Change &quot;unsigned int&quot; to &quot;unsigned&quot;.
/cvsroot/zile/zile/src/term_redisplay.c	2005-01-27 00:04:48.0	rrt	1.33	3	3	Add a buffer-local variable list to the Buffer struct, and move thetwo buffer-local variables (fill-column and tab-width) into it. Removetab_width and fill_column.Add tab_width to return a &quot;safe&quot; tab width, i.e. at least 1.Add get_variable_bp to get a variable for a particular buffer,get_variable_number to get a variable&apos;s value as a number, andget_variable_number_bp.Add variableSetNumber.Reduce the number of calls to read the value of tab-width where thisis easy.Make describe-variable get the value for the current buffer for abuffer-local variable.Improve doc strings for newline-and-indent and indent-command.
/cvsroot/zile/zile/src/term_redisplay.c	2005-01-20 22:23:28.0	rrt	1.32	2	2	Fix splash screen on small terminals.
/cvsroot/zile/zile/src/term_redisplay.c	2005-01-18 22:55:22.0	rrt	1.31	1	4	Make minibuffer welcome message be displayed when splash screen is too(fix ported from 2.0 branch).Don&apos;t mention F1 in splash screen, because it doesn&apos;t work on allplatforms (not even termcap at the moment).
/cvsroot/zile/zile/src/term_redisplay.c	2005-01-18 13:25:45.0	rrt	1.30	11	1	Move term_addnstr to term_redisplay, as it&apos;s generic.Add default (empty!) implementations of term_suspend and term_resumeto the other terminal types.
/cvsroot/zile/zile/src/term_redisplay.c	2005-01-18 13:06:15.0	rrt	1.29	17	1	Move term_printw to term_redisplay, because it&apos;s generic.Add term_suspend and term_resume (incomplete) to term_termcap.c.
