file	tstamp	developer	version	lines_add	lines_del	description
/cvsroot/zile/zile/lib/Attic/regex.c	2004-11-15 01:47:12.0	rrt	1.3	0	0	Move contents of lib/ into src/. This is slightly awkward at themoment, but means that x{malloc,realloc,strdup} can be replaced bycalls to z{malloc,realloc,dup}, and the machinery for building libzileis not needed (it was rather pointless, although it was used by mkdocand the test programs of the libraries, which now won&apos;t work and willhave to be resurrected).This makes the arrangement of the code a bit simpler.Also move the z* functions into zmalloc.c so they can easily be linkedinto mkdoc.c.
/cvsroot/zile/zile/lib/Attic/regex.c	2004-03-03 02:48:03.0	rrt	1.2	330	330	Whitespace cleanup.
/cvsroot/zile/zile/lib/Attic/regex.c	2004-02-14 23:19:03.0	ssigala	1.1	0	0	Modernize a bit configure.ac (now the maintainer email is generated into the config.h header)move regex.[ch] from src/ to lib/
/cvsroot/zile/zile/lib/Attic/regex.h	2004-11-15 01:47:12.0	rrt	1.2	0	0	Move contents of lib/ into src/. This is slightly awkward at themoment, but means that x{malloc,realloc,strdup} can be replaced bycalls to z{malloc,realloc,dup}, and the machinery for building libzileis not needed (it was rather pointless, although it was used by mkdocand the test programs of the libraries, which now won&apos;t work and willhave to be resurrected).This makes the arrangement of the code a bit simpler.Also move the z* functions into zmalloc.c so they can easily be linkedinto mkdoc.c.
/cvsroot/zile/zile/lib/Attic/regex.h	2004-02-14 23:19:03.0	ssigala	1.1	0	0	Modernize a bit configure.ac (now the maintainer email is generated into the config.h header)move regex.[ch] from src/ to lib/
/cvsroot/zile/zile/lib/Attic/strrstr.c	2004-11-15 01:47:12.0	rrt	1.4	1	1	Move contents of lib/ into src/. This is slightly awkward at themoment, but means that x{malloc,realloc,strdup} can be replaced bycalls to z{malloc,realloc,dup}, and the machinery for building libzileis not needed (it was rather pointless, although it was used by mkdocand the test programs of the libraries, which now won&apos;t work and willhave to be resurrected).This makes the arrangement of the code a bit simpler.Also move the z* functions into zmalloc.c so they can easily be linkedinto mkdoc.c.
/cvsroot/zile/zile/lib/Attic/strrstr.c	2004-05-10 18:00:26.0	rrt	1.3	4	2	Add code to configure.ac so that if we&apos;re building with GCC we getplenty of compiler warnings turned on. Always.As a result of this warnings bonanza, fix all the warnings found inthe rest of the code. Given a recent warnings cleanup, this was mostlylimited to extern functions that were not declared before beingdefined. In all cases here this was fixed by making the function static.
/cvsroot/zile/zile/lib/Attic/strrstr.c	2004-03-10 15:09:02.0	rrt	1.2	2	2	Add prototype to config.h for strrstr, and correct the declaration instrrstr.
/cvsroot/zile/zile/lib/Attic/strrstr.c	2004-03-10 14:01:12.0	rrt	1.1	0	0	Remove some rarely or never used astr functions, and debug and speed upastr_rfind_cstr, basing it on strrstr, an implementation of which isnow added to libzile.
/cvsroot/zile/zile/lib/Attic/vasprintf.c	2004-11-15 01:47:12.0	rrt	1.8	0	0	Move contents of lib/ into src/. This is slightly awkward at themoment, but means that x{malloc,realloc,strdup} can be replaced bycalls to z{malloc,realloc,dup}, and the machinery for building libzileis not needed (it was rather pointless, although it was used by mkdocand the test programs of the libraries, which now won&apos;t work and willhave to be resurrected).This makes the arrangement of the code a bit simpler.Also move the z* functions into zmalloc.c so they can easily be linkedinto mkdoc.c.
/cvsroot/zile/zile/lib/Attic/vasprintf.c	2004-10-23 17:36:37.0	rrt	1.7	1	1	Fix the type of a variable that needs to be a char or -1 (it should beint, not char).
/cvsroot/zile/zile/lib/Attic/vasprintf.c	2004-03-10 13:59:32.0	rrt	1.6	2	2	Only compile the functions in these files if the function is not inthe system library (i.e. test the HAVE_FOO symbol defined inconfig.h). vasprintf already did this, but before #including config.hwhich was useless.
/cvsroot/zile/zile/lib/Attic/vasprintf.c	2004-03-09 17:14:42.0	rrt	1.5	1	0	#include config.h to get vasprintf prototype on systems that don&apos;t have it.
/cvsroot/zile/zile/lib/Attic/vasprintf.c	2004-03-03 02:48:23.0	rrt	1.4	18	1	Add asprintf.
/cvsroot/zile/zile/lib/Attic/vasprintf.c	2004-02-18 00:25:38.0	rrt	1.3	632	645	Use GPL license instead of BSD (this is permitted as the code isdual-licensed), and dos2unix the file.
/cvsroot/zile/zile/lib/Attic/vasprintf.c	2003-05-25 23:41:39.0	rrt	1.2	1	1	Fix typo: HAS_VASPRINTF --&gt; HAVE_VASPRINTF
/cvsroot/zile/zile/lib/Attic/vasprintf.c	2003-05-25 23:20:12.0	rrt	1.1	0	0	Make vasprintf mandatory, and provide an implementation for thoseplatforms that lack it (courtesy of David Taillandier&apos;s xnprintf library).
/cvsroot/zile/zile/lib/Attic/vector.c	2004-11-15 01:47:12.0	rrt	1.4	1	1	Move contents of lib/ into src/. This is slightly awkward at themoment, but means that x{malloc,realloc,strdup} can be replaced bycalls to z{malloc,realloc,dup}, and the machinery for building libzileis not needed (it was rather pointless, although it was used by mkdocand the test programs of the libraries, which now won&apos;t work and willhave to be resurrected).This makes the arrangement of the code a bit simpler.Also move the z* functions into zmalloc.c so they can easily be linkedinto mkdoc.c.
/cvsroot/zile/zile/lib/Attic/vector.c	2004-10-23 17:36:03.0	rrt	1.3	2	3	Use char instead of uint8_t, to avoid requiring stdint.h. Assuming8-bit char is fairly safe these days...
/cvsroot/zile/zile/lib/Attic/vector.c	2004-03-09 17:15:11.0	rrt	1.2	2	1	#include stdlib.h to get free.
/cvsroot/zile/zile/lib/Attic/vector.c	2004-03-08 16:26:43.0	rrt	1.1	0	0	Add library.
/cvsroot/zile/zile/lib/Attic/vector.h	2004-11-15 01:47:12.0	rrt	1.3	1	1	Move contents of lib/ into src/. This is slightly awkward at themoment, but means that x{malloc,realloc,strdup} can be replaced bycalls to z{malloc,realloc,dup}, and the machinery for building libzileis not needed (it was rather pointless, although it was used by mkdocand the test programs of the libraries, which now won&apos;t work and willhave to be resurrected).This makes the arrangement of the code a bit simpler.Also move the z* functions into zmalloc.c so they can easily be linkedinto mkdoc.c.
/cvsroot/zile/zile/lib/Attic/vector.h	2004-03-09 13:52:17.0	rrt	1.2	2	1	Add vec_array to get at the array from a vector.
/cvsroot/zile/zile/lib/Attic/vector.h	2004-03-08 16:26:52.0	rrt	1.1	0	0	Add library.
/cvsroot/zile/zile/lib/Attic/xmalloc.c	2004-11-15 01:47:12.0	rrt	1.5	1	1	Move contents of lib/ into src/. This is slightly awkward at themoment, but means that x{malloc,realloc,strdup} can be replaced bycalls to z{malloc,realloc,dup}, and the machinery for building libzileis not needed (it was rather pointless, although it was used by mkdocand the test programs of the libraries, which now won&apos;t work and willhave to be resurrected).This makes the arrangement of the code a bit simpler.Also move the z* functions into zmalloc.c so they can easily be linkedinto mkdoc.c.
/cvsroot/zile/zile/lib/Attic/xmalloc.c	2004-03-10 13:59:32.0	rrt	1.4	5	1	Only compile the functions in these files if the function is not inthe system library (i.e. test the HAVE_FOO symbol defined inconfig.h). vasprintf already did this, but before #including config.hwhich was useless.
/cvsroot/zile/zile/lib/Attic/xmalloc.c	2003-05-07 00:28:41.0	rrt	1.3	0	0	Land the 1.7 sources. This is basically 1.7-a7 (unreleased except onSandro&apos;s home page) plus my and Nicolas Duboc&apos;s 1.6.2 fixes, plus somepatches to 1.7-a6 from David Capello.
/cvsroot/zile/zile/lib/Attic/xmalloc.c	2003-04-24 17:11:59.0	rrt	1.2	0	0	Committing 1.6.2 sources.
/cvsroot/zile/zile/lib/Attic/xmalloc.c	2001-01-19 23:01:44.0	ssigala	1.1	0	0	branches:  1.1.1;Initial revision
/cvsroot/zile/zile/lib/Attic/xmalloc.c	2001-01-19 23:08:00.0	ssigala	1.1.1.2	4	6	import of version 1.3.
/cvsroot/zile/zile/lib/Attic/xmalloc.c	2001-01-19 23:01:44.0	ssigala	1.1.1.1	0	0	import of version 1.4.
/cvsroot/zile/zile/lib/Attic/xrealloc.c	2004-11-15 01:47:12.0	rrt	1.7	1	1	Move contents of lib/ into src/. This is slightly awkward at themoment, but means that x{malloc,realloc,strdup} can be replaced bycalls to z{malloc,realloc,dup}, and the machinery for building libzileis not needed (it was rather pointless, although it was used by mkdocand the test programs of the libraries, which now won&apos;t work and willhave to be resurrected).This makes the arrangement of the code a bit simpler.Also move the z* functions into zmalloc.c so they can easily be linkedinto mkdoc.c.
/cvsroot/zile/zile/lib/Attic/xrealloc.c	2004-03-10 13:59:32.0	rrt	1.6	5	1	Only compile the functions in these files if the function is not inthe system library (i.e. test the HAVE_FOO symbol defined inconfig.h). vasprintf already did this, but before #including config.hwhich was useless.
/cvsroot/zile/zile/lib/Attic/xrealloc.c	2004-03-08 15:32:50.0	rrt	1.5	1	2	Don&apos;t need assert.h any more since no more assertions.
/cvsroot/zile/zile/lib/Attic/xrealloc.c	2004-03-08 15:32:18.0	rrt	1.4	2	5	Get rid of assertions: ptr == NULL or size == 0 are allowed byrealloc, so should be allowed by xrealloc.
/cvsroot/zile/zile/lib/Attic/xrealloc.c	2003-05-07 00:28:41.0	rrt	1.3	0	0	Land the 1.7 sources. This is basically 1.7-a7 (unreleased except onSandro&apos;s home page) plus my and Nicolas Duboc&apos;s 1.6.2 fixes, plus somepatches to 1.7-a6 from David Capello.
/cvsroot/zile/zile/lib/Attic/xrealloc.c	2003-04-24 17:11:59.0	rrt	1.2	0	0	Committing 1.6.2 sources.
/cvsroot/zile/zile/lib/Attic/xrealloc.c	2001-01-19 23:01:45.0	ssigala	1.1	0	0	branches:  1.1.1;Initial revision
/cvsroot/zile/zile/lib/Attic/xrealloc.c	2001-01-19 23:08:00.0	ssigala	1.1.1.2	4	6	import of version 1.3.
/cvsroot/zile/zile/lib/Attic/xrealloc.c	2001-01-19 23:01:45.0	ssigala	1.1.1.1	0	0	import of version 1.4.
/cvsroot/zile/zile/lib/Attic/xstrdup.c	2004-11-15 01:47:12.0	rrt	1.5	1	1	Move contents of lib/ into src/. This is slightly awkward at themoment, but means that x{malloc,realloc,strdup} can be replaced bycalls to z{malloc,realloc,dup}, and the machinery for building libzileis not needed (it was rather pointless, although it was used by mkdocand the test programs of the libraries, which now won&apos;t work and willhave to be resurrected).This makes the arrangement of the code a bit simpler.Also move the z* functions into zmalloc.c so they can easily be linkedinto mkdoc.c.
/cvsroot/zile/zile/lib/Attic/xstrdup.c	2004-03-10 13:59:32.0	rrt	1.4	7	3	Only compile the functions in these files if the function is not inthe system library (i.e. test the HAVE_FOO symbol defined inconfig.h). vasprintf already did this, but before #including config.hwhich was useless.
/cvsroot/zile/zile/lib/Attic/xstrdup.c	2003-05-07 00:28:41.0	rrt	1.3	0	0	Land the 1.7 sources. This is basically 1.7-a7 (unreleased except onSandro&apos;s home page) plus my and Nicolas Duboc&apos;s 1.6.2 fixes, plus somepatches to 1.7-a6 from David Capello.
/cvsroot/zile/zile/lib/Attic/xstrdup.c	2003-04-24 17:11:59.0	rrt	1.2	0	0	Committing 1.6.2 sources.
/cvsroot/zile/zile/lib/Attic/xstrdup.c	2001-01-19 23:01:45.0	ssigala	1.1	0	0	branches:  1.1.1;Initial revision
/cvsroot/zile/zile/lib/Attic/xstrdup.c	2001-01-19 23:01:45.0	ssigala	1.1.1.1	0	0	import of version 1.4.
/cvsroot/zile/zile/src/.cvsignore	2005-01-23 01:23:52.0	rrt	1.8	1	1	Remove htable.
/cvsroot/zile/zile/src/.cvsignore	2005-01-19 02:24:27.0	rrt	1.7	2	1	Add Lisp tests. These do not seem to be counted in the test suitepass/fail count yet, but they are correctly run by make check.
/cvsroot/zile/zile/src/.cvsignore	2005-01-12 01:43:40.0	rrt	1.6	0	1	Move man page to doc.
/cvsroot/zile/zile/src/.cvsignore	2004-11-15 13:36:13.0	rrt	1.5	1	0	Add stub zile_exit function to tests and mkdoc so they can use zmallocand friends. This is ugly, but the simplest thing I can think of.Add tests to src/.cvsignore.Add the object files the tests need to src/Makefile.am.
/cvsroot/zile/zile/src/.cvsignore	2004-10-14 02:50:27.0	rrt	1.4	0	1	Remove fontlock_*.c, which no longer exist.
/cvsroot/zile/zile/src/.cvsignore	2004-01-28 13:08:32.0	rrt	1.3	2	0	Add Makefile.in
/cvsroot/zile/zile/src/.cvsignore	2003-08-11 18:12:18.0	rrt	1.2	1	0	Add fontlock_*.c.
/cvsroot/zile/zile/src/.cvsignore	2003-05-16 17:17:54.0	ssigala	1.1	0	0	added files to ignore configure generated files.
/cvsroot/zile/zile/src/Makefile.am	2005-01-26 16:21:14.0	rrt	1.37	6	13	Remove strrstr.c and vasprintf.c from zile_base_SOURCES, as they aredetected by AC_REPLACE_FUNCS. Add the files to EXTRA_DIST so they arein the tarball.Add @LIBOBJS@ to zile_LDADD, so that AC_REPLACE_FUNCS works properly.
/cvsroot/zile/zile/src/Makefile.am	2005-01-25 17:02:23.0	rrt	1.36	2	2	Add tests to EXTRA_DIST and bump version to 2.1.0.The 2.1 development branch is go!
/cvsroot/zile/zile/src/Makefile.am	2005-01-22 14:13:14.0	rrt	1.35	1	2	Remove rc.c, and fold read_rc_file into main.Tidy some comments in funcs.c.
/cvsroot/zile/zile/src/Makefile.am	2005-01-22 12:30:14.0	rrt	1.34	3	8	Remove htable, as it&apos;s no longer used (was only used by variableimplementation).
/cvsroot/zile/zile/src/Makefile.am	2005-01-22 00:40:43.0	rrt	1.33	1	4	Remove outdated mentions of alist.
/cvsroot/zile/zile/src/Makefile.am	2005-01-22 00:37:04.0	rrt	1.32	3	6	Make Lisp tests get counted properly by make check.
/cvsroot/zile/zile/src/Makefile.am	2005-01-19 02:24:27.0	rrt	1.31	7	4	Add Lisp tests. These do not seem to be counted in the test suitepass/fail count yet, but they are correctly run by make check.
/cvsroot/zile/zile/src/Makefile.am	2005-01-19 01:40:49.0	rrt	1.30	2	2	Rename lithp.c to lisp.c.Rename lithp to lisp_read_file, and add lisp_read_string and genericlisp_read.Implement --batch, --eval and --load.When using --load or --eval in non-batch mode, insert the results intothe scratch buffer instead of the default scratch message.Fix some space leaks in lisp_read and in the Lisp interpreter itself.Reformat some more of the Lisp code (mostly excess spaces).
/cvsroot/zile/zile/src/Makefile.am	2005-01-17 23:43:13.0	rrt	1.29	1	3	Use getopt_long_only instead of getopt_long for better Emacscompatibility (i.e. long options can start with a single dash).Rejig the getopt code again (remove lots more non-ANSI stuff) and useAC_REPLACE_FUNCS to import getopt_long_only.c. Assume that if we havethis function then we have getopt.h.
/cvsroot/zile/zile/src/Makefile.am	2005-01-17 02:08:30.0	rrt	1.28	3	1	Add GNU getopt for getopt_long where necessary.
/cvsroot/zile/zile/src/Makefile.am	2005-01-12 02:47:45.0	rrt	1.27	10	1	Add a lisp interpreter, code taken from lithp 0.6(http://www.cis.rit.edu/~jerry/Software/lithp/).Since the original was written with noweb, I&apos;ve tangled the code,stripped out the #line directives, and reformatted it.I&apos;ve also done something a bit naughty: I&apos;ve fixed up most of the gccwarnings, and done a little tidying to make that work, hence the codeis not quite the same as lithp 0.6. I&apos;m checking it in now before Ireally start changing stuff.At the moment the code is simply compiled into Zile, but not calledanywhere.Justification: having a Lisp interpreter will simplify and unify a lotof things. First, it will handle the .zilerc file (and hence get ridof rc.c and a lot of variables.c). Secondly, it will simplify addingkey rebinding. Thirdly, it&apos;s entirely in line with Emacs emulation. Itwill similarly simplify the handling of macros, and allow Zile to beextended at last by the user. Fourthly, it will help implement keymaps, which are needed to remove horrible code duplication in theminibuffer code. Finally, some of the current C code will be rewrittenin Lisp, and it will hence improve stability (as Lisp code won&apos;tcrash, right?!).I will try very hard to reduce the binary size to at most the same asit was before I added the interpreter, which is only 2,000 lines ofcode. It adds about 50Kb to the unstrippped binary; I have alreadyremoved nearly 20Kb since the current 2.0 beta, so that leaves another30Kb to remove. I&apos;ll try to do the same in the source code, but that&apos;sless important (and less likely). Anyway, Zile should get no morecomplex than it is at present until some other major feature is added(the only one planned is Unicode support).I have yet to put in proper copyright notices in the files from lithpand proper acknowledgement for this major contribution in the docs.The lithp code will also doubtless be heavily modified (and reduced!).
/cvsroot/zile/zile/src/Makefile.am	2005-01-12 01:43:05.0	rrt	1.26	2	11	Move the man page into the doc directory.
/cvsroot/zile/zile/src/Makefile.am	2005-01-10 01:24:59.0	rrt	1.25	1	3	Move agetcwd into file.c and the prototype into extern.h (this is aZile function, not a reimplementation of a standard function).
/cvsroot/zile/zile/src/Makefile.am	2005-01-09 19:19:15.0	rrt	1.24	1	2	Fold editfns.h into extern.h. It might be nice to have a more modularstructure, but we don&apos;t, so might as well keep things simple.
/cvsroot/zile/zile/src/Makefile.am	2005-01-09 19:11:12.0	rrt	1.23	3	3	Replace the list implementation. The new implementation is mine, andalthough its publically released form (rrtlib) is unstable, thisparticular library is small and has been used several times indifferent projects and can be considered mature.The new implmentation is better because:1. It is smaller and simpler.2. The new lists are stateless (do not store a position during list   traversal).3. The new list type can replace Line (they&apos;re basically the same   type).3. The new lists are manipulated entirely via the API, so that in   particular the next and prev links won&apos;t be corrupted by sloppy   programming, and check_list in main is made redundant (once the   list type has been used to replace Line).Remove spurious vsprintf from minibuf_format (which just repeated thework of the preceding vasprintf).Factor most of minibuf_write and minibuf_error into minibuf_vwrite;this also fixes the bug that minibuf_error now refreshes the terminal.Remove redundant term_refresh calls after minibuf_write andminibuf_error, which already call it.
/cvsroot/zile/zile/src/Makefile.am	2005-01-03 13:29:39.0	rrt	1.22	2	2	branches:  1.22.2;Fix astr_fgets test for VPATH builds.
/cvsroot/zile/zile/src/Makefile.am	2005-01-03 13:09:20.0	rrt	1.21	1	3	Remove obsolete INCLUDES line.
/cvsroot/zile/zile/src/Makefile.am	2004-11-16 01:35:44.0	rrt	1.20	6	1	Add EPOC support (in term_epocemx.c).Add --enable-epocemx to configure.acRemove gperf test from configure.ac.Note: term_epocemx.c currently duplicates quite a lot ofterm_termcap.c, of which it is a heavily modified version. I willfactor out the comon bits shortly.Also, building under epocemx requires a configure line something like:./configure --build=&lt;current-platform&gt; --host=arm-epoc-pe --enable-epocemx
/cvsroot/zile/zile/src/Makefile.am	2004-11-15 13:36:13.0	rrt	1.19	4	1	Add stub zile_exit function to tests and mkdoc so they can use zmallocand friends. This is ugly, but the simplest thing I can think of.Add tests to src/.cvsignore.Add the object files the tests need to src/Makefile.am.
/cvsroot/zile/zile/src/Makefile.am	2004-11-15 01:47:12.0	rrt	1.18	33	3	Move contents of lib/ into src/. This is slightly awkward at themoment, but means that x{malloc,realloc,strdup} can be replaced bycalls to z{malloc,realloc,dup}, and the machinery for building libzileis not needed (it was rather pointless, although it was used by mkdocand the test programs of the libraries, which now won&apos;t work and willhave to be resurrected).This makes the arrangement of the code a bit simpler.Also move the z* functions into zmalloc.c so they can easily be linkedinto mkdoc.c.
/cvsroot/zile/zile/src/Makefile.am	2004-10-11 03:08:42.0	rrt	1.17	3	11	Remove ncurses interface. We no longer have any dependencies onexternal libraries!
/cvsroot/zile/zile/src/Makefile.am	2004-09-04 04:37:38.0	dacap	1.16	3	1	*** empty log message ***
/cvsroot/zile/zile/src/Makefile.am	2004-09-03 04:09:08.0	dacap	1.15	7	1	Added the Allegro interface.
/cvsroot/zile/zile/src/Makefile.am	2004-07-01 00:52:41.0	rrt	1.14	12	4	Add support for different implementations of the terminal interface,and add preliminary term.h/termio.h interface. The default interfaceis still curses, and it can be disabled with --disable-curses passedto configure.zterm.h is now the header included by C files, which in turn includesthe implementation header, currently either term_ncurses.h orterm_termcap.h.
/cvsroot/zile/zile/src/Makefile.am	2004-05-20 23:41:05.0	rrt	1.13	2	4	Expunge the last references to term_ncurses directory and libterm_ncurses.a
/cvsroot/zile/zile/src/Makefile.am	2004-05-10 18:49:50.0	rrt	1.12	3	2	Move contents of ncurses_key.c into term_ncurses.c. Get rid of theterm_ncurses subdirectory altogether. We now have just oneterm_foo.{c,h} file per Terminal implementation, and a number ofterm_*.c files that build on top of this. In fact, this storyis about to get a whole lot simpler too.
/cvsroot/zile/zile/src/Makefile.am	2004-05-10 18:05:49.0	rrt	1.11	2	1	Move ncurses_redisplay.c up to term_ncurses.c; it no longer needsncurses.h. Only two more files to go!
/cvsroot/zile/zile/src/Makefile.am	2004-05-09 20:31:06.0	rrt	1.10	2	1	Move term_ncurses/ncurses_minibuf.c to term_minibuf.c.
/cvsroot/zile/zile/src/Makefile.am	2004-04-04 22:33:12.0	rrt	1.9	1	2	Font-lock removed.FAQ overhauled.
/cvsroot/zile/zile/src/Makefile.am	2004-03-20 18:50:20.0	rrt	1.8	1	2	Removed lua.c
/cvsroot/zile/zile/src/Makefile.am	2004-03-14 15:36:06.0	rrt	1.7	4	62	DON&apos;T PANIC! I have tagged the tree with the tag &quot;fontlock-apocalypse&quot;before committing this set of changes.Remove font-lock modes (N.B. *not* font-lock support!). The font-locksystem in zile was a Bad Thing: * It was a maintenance burden because of conditional compilation and   configure options. * It was a lot of complicated code. Several recent bugs have been   font-lock bugs. * In terms of functionality (and to a lesser extent, code size) it   was a bloat on an editor that should be small, clean and simple. * It added a dependency on gperf (admittedly not a big problem).I have retained font-lock support, and made it always-on. Regex-basedfont-lock should be implemented, similar to that in many othereditors. Preferably, we should adopt an existing regex patterns format(e.g. that of NEdit) so that we have access to a wide range offontlock modes, and users don&apos;t have to make yet another crufty set.Alternatively, it may be better in an editor the size of zile toremove font-lock altogether.Remove experimental Lua support. For similar reasons to those above,it was a bad idea.
/cvsroot/zile/zile/src/Makefile.am	2004-02-14 23:19:03.0	ssigala	1.6	2	11	Modernize a bit configure.ac (now the maintainer email is generated into the config.h header)move regex.[ch] from src/ to lib/
/cvsroot/zile/zile/src/Makefile.am	2004-02-08 05:39:26.0	dacap	1.5	17	4	Rewritten point/marker API mainly.
/cvsroot/zile/zile/src/Makefile.am	2004-02-05 03:38:27.0	dacap	1.4	3	1	Added regex files.
/cvsroot/zile/zile/src/Makefile.am	2004-02-04 03:49:31.0	dacap	1.3	2	3	Removed the $(lua) variable from zile_LDADD.
/cvsroot/zile/zile/src/Makefile.am	2004-01-29 11:37:00.0	rrt	1.2	4	3	Remove version.h and add lua.c.
/cvsroot/zile/zile/src/Makefile.am	2004-01-23 02:46:25.0	dacap	1.1	0	0	Added the automake support.
/cvsroot/zile/zile/src/Makefile.am	2005-01-26 16:17:21.0	rrt	1.22.2.1	6	13	There are no code changes since 2.0beta9.Bump version to 2.0beta10.Remove irrelevant bits from configure.ac as on HEAD.Fix use of vasprintf.c and strrstr.c: don&apos;t compile them when they&apos;renot needed, but make sure to include both in the distribution.Fix use of AC_REPLACE_FUNCS.
/cvsroot/zile/zile/src/Attic/Makefile.in	2004-01-23 03:14:46.0	dacap	1.8	1	1	Removed auto-generated and unnecessary files.
/cvsroot/zile/zile/src/Attic/Makefile.in	2003-05-19 23:50:24.0	rrt	1.7	1	3	Sandro suggested replacing pathbuffer_t with astr. This set of patchesis the rather ugly result, although it&apos;s not as bad as it looks: lotsof the changes are just making char * --&gt; const char *. One or twoinfelicities, such as the fact that one history method now take anastr, while another still takes a char *, need fixing. Since I proposeto carry on cleaning up the code generally, that shouldn&apos;t be too muchof a problem.However, this set of changes definitely validates the decision to gofor a 1.6.2 release before releasing 1.7! 1.7 may now take a littlewhile to stabilise.
/cvsroot/zile/zile/src/Attic/Makefile.in	2003-05-07 00:28:41.0	rrt	1.6	32	10	Land the 1.7 sources. This is basically 1.7-a7 (unreleased except onSandro&apos;s home page) plus my and Nicolas Duboc&apos;s 1.6.2 fixes, plus somepatches to 1.7-a6 from David Capello.
/cvsroot/zile/zile/src/Attic/Makefile.in	2003-05-06 15:13:15.0	rrt	1.5	3	1	Corrected accidental removal of pathbuffer files in last checkin.
/cvsroot/zile/zile/src/Attic/Makefile.in	2003-05-06 13:53:48.0	rrt	1.4	2	4	Add pathbuffer.{c,o} from Nicolas Duboc&apos;s fixes, and fix programdependencies to $(ZILELIBS), not $(LIBS), so we don&apos;t try to build-lncurses or -lcurses (weirdly this worked on Linux; perhaps GNU Makehas some magic to cope with idiocy of this sort).
/cvsroot/zile/zile/src/Attic/Makefile.in	2003-04-24 17:36:49.0	rrt	1.3	3	1	Fix compilation on GNU/HURD. Patch from Nicolas Duboc [nicolas@duboc.net]
/cvsroot/zile/zile/src/Attic/Makefile.in	2003-04-24 17:11:59.0	rrt	1.2	13	15	Committing 1.6.2 sources.
/cvsroot/zile/zile/src/Attic/Makefile.in	2001-01-19 23:01:45.0	ssigala	1.1	0	0	branches:  1.1.1;Initial revision
